unit_id,doc,year_ref,unit
1797-1798_7_image,arrearagia recepta recepta anni praesentis bankers receipt recepta varia debit anni praecedentis summa omnium receptorium rectori scholaribus et officiaris ordinaria varia deficiency of rector s stipend de deni de regis march marzo 1798 p 245 et receptis 2588 8 6 deductis solutis 1866 1 10 resti solvend 722 6 8 h richards rectorem j cole subrectorem j demainbray decanum tho smyth clebb buss sen samuel hart buss jun j l hayes s th prod,1797,page
1797-1798_8_image,gwinear rectory a year half menhennist do kidlington do two years thrupp annuity five years half lucas eaton cox two years bampton do morlacu te three years jesus college hertford college two years kemp st martin s do trethewin a year half wild arish two years lad lane conyns do do d wilson two years do halifax two years mr g p turner beverett s close little jew timber a year half do br gardiner hester s two years do do evins s two years do beck late ryman s two years do bonwell do two years do leonard do two years do curnock do two years medenham do two years long wittenham rectory so newington do merton do chase hill do kidlington mills gassington sadler do prickett tinternall r napier do beaton three years clifton terry do so newington his tenement little jew taylor two years do judge two years do hiorn s two years do br gardiner burdent two years do hartley two years,1797,page
1798-1799_1_image,gwinear rectory a year menhenniot a year thrup annuity 5 years half jesus college will arnold a year mederham a year leveritts close little lew kimber a year half b gardiner hester 2 years d ewas banwell d leonard d mixed rents variella so kewington rectory kidlington mills garington tadler d prickett tinnehull napier clifton ferry so kewington tenement little lew taylor 2 years d judge d horns b gardiner burdon d d hartley kidlington capons braws thrup annuity year to l day kidlington vicarage back gate coppice little lew kimber b gardiner hesper d evans banwell leonard,1798,page
1798-1799_2_image,hillington augmentatio little tew taylor ldge thos b gardner burdens hartley brot over jan 2 years div on 5108 17 5 3 pcents april do on 546 0 9 4 pcents july do 3 pcents as before oct do 4 pcents as before exchequer ann year to july 5,1798,page
1798-1799_3_image,nov 17 of mr farley dr shortrudges benefaction 1st half year of 1798 due xmas 22 of mr rigaud mr combi plate money dec 7 of mr heyes mr heginbotham s do 22 rent of l witteham rectory to mich 1799 4 of mr cole mr heywoods plate money 17 of mr heyes mr barry s do 18 of mr burridge carriage from mr hapur s levey mar 23 settled with mr harker for merton viz money rent due mich 1798 corn rent do land tax leveretts close balance recd may 25 of mr farley dr shortrudges benefaction 2d half year of 1798 due xmas june 30 of mr demanbray deans fees july 3 of mr glubb increment midi 20 house window tax 4 years returned oct 19 of john bush esqr purchase money of y thrup annuity,1798,page
1798-1799_4_image,long wittenham div year to l day 1798 d to mich stip ad fest nativ et officiariis augm j hewington merton thiers s stipend d augm com et capellanis rectori ut prius stip ad fest annun kidlington aug pro 3 ann partibus rectori ut supra merton div to l day 1798 d mich stip ad fest d j bapt et officiariis dom thiers ad dict fest augm com d moderatoris et sub dec kidli augm pro 4 te parte anni rectori ut supra guinear stip ad fest mich long wittn pro augm com rectori ut supra ap 5 rich irons fine for little tew 15 rob harkins pr merton,1798,page
1798-1799_5_image,civitati oxon mayor s capons curia hustings coll aedis christi do coll omn animarum coll ball coll s j baptista archdeacon s procurations supervision aedificiorum taylor janitori hooper bibliothecario ad fest s i b mitchell s pens do bibl et pro 5 oct concionatori mr roper pauperibus postage stamps carriage c land tax to coll aedis christi do parish do house window tax bedell of beggars vicar of merton a year to christ s hewington do corn prices three curia hustings for 1797 omitted here,1798,page
1798-1799_6_image,nov 12 seven poor s rates to st mich parish 1 gaol tax 1 militia 1 trophy rate 13 mr regard for arms c by order 22 domus wine bile much dr 24 w hinton improving his room by order 26 paving lighting tax to mr midi dec 20 repairs done at d withersham 20 searsbrook for a bell rope jan 2 w purdue in self judge melbourn 4 tom dodd lightly lamps oil c mr hart bursar deirien at xmass feb 15 subscription to radcliffe infirmary 7 w munday transcribing statutes for mr th domus wine bill xmass dulcet rain 14 mr jones coll tax on armorial bearings apr 1 town poor s rates to st mich 1 militia tax 5 insurance of l witt due at lady day 9 mr rigauld arms c at mr bile 11 dridil 7th instalment of assessed taxes may 4 allowed for bush 6 years land tax in thrap ann june 26 mr walsh pris for long witt 3 years july 3 domus wine bile medir dr robinson s bill for chapel aug 31 expences of journey to welwyn oct 18 vice chan purchased of coll lands tax mr clark for survey maps of little tew 26 mr rigauld for appreciation expences 28 mr glub a mistake in bursars acct mridi 2 years nov 1 mr heyes expences of progress leach carpenter s bill tull carrying rubbish c knowles townsend masons power smith bolton plumber hewlett plasterer greene painter denton gardener bush ironmonger,1798,page
1798-1799_7_image,arrearagia recepta receptd anni praesentis bankers receipts recepta varia debit anni praecedentis summa omnium receptorium rector scholaribus officiariis ordinaria varia deficiency of rector s receipts see decree of march 10 1798 register p 245 summa omnium solutorum ex receptis deductis solutis rest solvend a d o computante h richards rectorem j cote subrectorem tho smyth cobb burs sens j l hayes decanum s hart burs jun j rosser j st prad,1798,page
1798-1799_8_image,guinear rectory a year half minhennist do kidlington do three years yardington do do l tenement lucas eaton three years bampton two years mountacute four years jesus college hertford college three years kemp st martins two years padbury st mary magd trelhewin two years half wild arish two years lad lane comyns two years do wilson three years do hallifax three years medenham two years leveretts close j g p turner little jew beck i three years do cursrock three years long wittenham rectory so newington do merton do chace hill two years kidlington mills garrington sadler do prickett tintinhull napier do beaton four years clifton ferry bensington so newington tent,1798,page
1799-1800_1_image,gwintear rectory year x half meahenrick do kidlington do three years yardington do do tenement bampton two year jesus college trethewim two years half lad lane comyns one year do willis do halifax mederham two years leveretts close so newington rectory kidlington mills garrington prickett clifton ferry bensington so newington tent chase hill two years kidlington copons brown do vicarage trethewin year to l day gwintear rectory do do kidlington augmentation clifton ferry chase hill,1799,page
1799-1800_2_image,jan half years div on 5108 17 5 3 d cents april d o on 546 0 0 4 p cents july d o 3 p r cents as before oct d o 4 p r cents as before exchequer ann a year to july 5 nov 24 d r shortrudges benefact n to mids 1799 dec 29 rent of l witteham rectory to mich s 550 money rent to mich s 1799 corn rent d o mar 29 deduct land tax 34 7 0 leverett s close 6 10 10 balance received may 10 d r shortrudges ben n to christmas 1799 24 m r heywood s room rent 3 2 rs omitted in battells now paid by m r glubb one fourth of s w clayfon s fine june 30 of m r heyle dean fees to house july 1 m r o brien s plate money 5 of m r glubb burser increm mids r 10 of m r subrector cole act fees for d d rs of m r blackall steward of the com room half the bill for the bursary curtains nov 1 hon m r massey plate money,1799,page
1799-1800_3_image,long wittenham div to l day 1799 do mich do stipend ad fest nativ et officiariis augment jo newington vs merton thiers stipend do augment com et capellaniis rectori ut prius stipend ad fest annu kidlington augment pro 3 partis anni rectori ut supra merton dnis to l day 1799 do mich do stipend ad fest d j bapt officiariis dno theers ad dict fest d j augm com moderatoris et sub decano kidlington augm pro 4ta parte anni rectori ut supra gwinisar stipend ad fest michl l wittenham pro augm com rectori ut supra mr knappi fine for kidlington mr pritchetts do for garsington mr gardinai do for l fels mr timber s do for do mr straing s do for yaraton mr bennetts do for gwinear,1799,page
1799-1800_4_image,civitati oxon mayor capons curia hasting coll dis christi do coll omn animarum coll balliol coll d joan bapt archideacon s procurations supervision aedificiorum janitori bibliothecario pro ann ad d j bapt do michelis pens ad do biblect c pro 5 oct concionatori ad fest parch pauperibus postage stamps carriage c land tax to coll s m aple do parish of s mich house window tax bedell of beggars vicar of merton a year to michl to newington a year to do corn prices candlemass l day mich,1799,page
1799-1800_5_image,eight poors rates one gad tax st michl cillege income tax 3 first instalments 23 mr dewes paving lighting to mids dec 6 mr taunton fee for i progress 11 hughes cooper bill 24 d holmes 12 years subscription last 31 w purdue pr mr judge 0 19 5 5 self 1800 jan 3 tom dodd lamp lightin oil c 7 mr hart bursar decrement at xmas 10 subscription to infirmary 27 ward for carnage of curtains mar 6 mr blackhall xmas dr wine bill 27 town poors rates one militia tax st michl 29 dominus wine bill lady day ap 4 to aaron vincent for services before ap 2 4 oder insurance mr 14 6 0 wittenham 1 1 6 28 messs seddon s bill for curtains 29 scamhook for a bell rope june 5 college income tax 3 last instalment 30 mr rigard for association mr lloyd for i c peggis mineral waters d hughes medenham expences 14 13 10 oct 17 newman s bill for lattries 22 bolton plumbers bill knowles mason do leach carpenter do hewlett slatter c do 24 penson gardener do 27 w purdue bill domus six poors rates to st mich 28 mr glubb a h 7 bill for measurement sale survey valuation of trethew 30 pavers smith bill greese painter do fulls carrying rubbish c lock goldsmith nov 1 bush ironmonger c,1799,page
1799-1800_6_image,arrearagia recepta recepta anni praesentis bankers receipts recepta varia debit anni praecedentis excefs of rectors stipend above 500 see register p 245 summa receptorum rectori scholaribus et officianis soluta ordinaria soluta varia paid mr harris in part of contract for the rectors lodgings summa solutorum ex recepti 2831 16 9 3 4 deductis solutis 2338 12 10 rest solvend 493 3 11 a dno computante j richards rectorem j cole subrectorem tho smyth glubb burs sen i hart burs junr j i hages decanum j rhodes s th prael,1799,page
1800_1_image,nov 4 com room midi 0 10 4 michl 0 3 3 12 subscription for purchasing corn by order 25 college income tax 3rd installment dec 5 mr dewe paving lighting to midt 31 w purduc self 0 18 2 mr judge 1 6 4 1807 jan 1 taxes to overseers of st michael s 5 decrement xmas year mr start bur 23 tom dodd for lamp lighting a year 26 vice chancellor indemnification of bakers feb 25 to d half of 10 guineas subscribed for imp mar 24 wine bill xmas 1 9 3 lucar eaton 0 18 1 2 lady day 2 30 poors rates to st mich ap 4 insurance coll 14 6 0 wittenham 1 1 6 13 one poors rate st mich 29 mr davis of bloxham s bill surveying the subscription to infirmary for 1801 may 7 dr hughes for congrs rent 3 3 0 exp other share 19 dr holmes subscription for publishing septuags 22 college income tax 3rd instalment to ap 5 june 27 tubb s bill for lamp ironwork from jan 1 1800 to full july 2 mr hollands bill in lieu of candles d omitted in last years account q u oct wedgwood bill for table service 30 hewlett plasterer bill in full davies smith d knowles mason d 31 leach carpenter d tubb carter c d penson gardener d greene painter d bolton plumber d mr harris a further payment for the lodging 600 paid before,1800,page
1800_2_image,gwinear rectory half a year menhenniot do kidlington do lucas eaton four years bampton mountacute five years jesus college hertford college four years kemp st martin s three years padbury st mary magd two years trethewim half a year wild arish three years back gate coppin lad lane comyns two years do wilson three years do hallifax three years medenham leverett s clore st j p turner little tew kimber do gardiner heiteri do do for evins do beck four years do banwell do leonard do curnock four years long wittenham rectory st newington do merton do kidlington mills garsington sadler two years do prickett tintinhulle napier two years do beeton five years bensington st newington tenement little tew taylor do judge do atkins do gardiner for burdon s do hartley yarnton removed from fixed rents la day for year by act composition michl do as for lease,1800,page
1800_3_image,minhenniot rectory jesus college wild arish three years back gate coppin lad lane coyngns two year do wilson now hardy three years do halifax now pickford three years medeham leverett s close j g p turner south hewington rectory kiddlington mills garrington prickett bensington so hewington tent yardington rect tent 421 14 3 kiddlington vicarage kiddlington augmentation 352 2 6,1800,page
1800_4_image,jan half years div on 5108 17 5 consols 3 p cts april d o on 546 0 9 4 p cents july d o 3 p r cents as before oct d o 4 p r cents as before exchequer annuity a year to july 5 1800 nov 5 mr montgomery s plate money ee 20 rent of long wittenham rectory to michs 25 dr shorbudge s benefaction 1 half year 1801 jan 26 of the vice chancellor 1 3 of the 50l paid for the purchase of corn returned mar 30 mr wrice s plate money ap 4 mr harkins acct for merton viz money rent due michs 1800 corn rent d o in all land tax leveretti clase balance received one fourth of medenham timber money may 16 of f cole mr toms legacy to college mr hawell s plate money june 5 dr shorbudge s 2 payment to xmas 1800 29 of mr heys dean fees for degrees 30 of mr glubb bursar increm donum,1800,page
1800_5_image,long wittenham div to l day 1800 d michl d stipend ad test hoki et officiariis augment j newington et merton nativ stipend dno thiers augment com et capellanis dno rectori ut prius merton div to l day 1800 d michl d stipend ad test annun ad test kidlington augm pro 3bu anni partibus annun dno rectori ut supra stipend ad test d i b et officiariis dno thiers ad dict fest d i aug com moderi et sub decano bapt kidlington augm pro 4ta part anni dno rectori ut supra gwinzear ship ad test mich l wittenham pro aug com dno rectori ut supra dennis t mi for s newington ten,1800,page
1800_6_image,civitati oxon majori caponi curia hastingr coll dis xti do coll omn anim coll balliol coll s j baptist arch deacon s procurations supervisor dificiorum janitori bibliothecario pro anno eidem michellei pen bibl de pro 5 oct concionatori ad fe t pa ch vicar of merton pro anno to hewington d pauperibus po tage stamps carriage c land tax to coll a heton d to daniel of st mich hou e window tax bedell of beggars corn prices of the year 3,1800,page
1800_7_image,arrearagia recepta recepta anni praesentis bankers receipts recepta varia deb anni praecedentis summa receptorum rectori scholaribus et officiariis soluta ordinaria varia deficiency of rector s stipend summa solutorum ex receptis deductis solutis rest solvend,1800,page
1801_1_image,long wittenham rectory south kewington do merton do yardington do tent chase hill kidlington mills garsington sadler three years do prickett tintinhull napier three years do beaton six years clifton terry bensington so kewington tent taylor two years judge hirons gardiner burdons do hartley,1801,page
1801_2_image,gwinear rectory a year half kidlington capon brown lucas eaton five years kemp st martin s three years padbury st mary magd three years trelhewinn a year back gate coppin leverettis close s t g p t so hawrington rectory yardington d tent chace hill kidlington mills garrington sadler three years do prickett tinkinhull napier three years clifton terry bensington so newington tent 607 15 4 1 4 gwinear rectory half a year kidlington capon brown do vicarage do augmentation 188 5,1801,page
1801_3_image,jan half years divn on 5708 17 5 3 pr cent cut consols april do on 5460 0 9 4 pr cent july do 3 pr cent as above oct do 4 pr cent as above exchequer annuity a year to july 5 jan 7 of the v chancellor the rent of the 50 subscribed for see jan 26 in last acct 19 dr shorthidge s benefaction to michl 1801 dec 19 long wittenham rent to michl last mr harkins acct for merton viz money rent to michl 1801 corn rent do land tax leverett s clove balance received apr 7 of mr heyes mr hilvert s plate money may 3 of mr judchen mr shawes do 13 of do mr deard s do june 1 of do mr harris s do 25 dr shorthidge s benefaction to christmas 30 of mr heyes mr seppy s plate money do dean s fee to the house of mr glubb b wan increment oct of mr heyes for the library of do mr davis s plate money,1801,page
1801_4_image,long wittenham div to l day 1801 do to michl do stipend ad test hativ et officiaris augm so kewington merston stipend dno thiers augm com et capellanis dno rectori ut supra merton div to l day 1801 do michl do ad fest stipend ad fest annuni kidleighton augm pro 3 ta anni partibus dno rectori ut supra ad fest stipend et officiar is do thiers d ioan augm com moderatori et sub decano kidleighton augm pro l ta parte anni dno rectori ut supra ad gwinnear stipend ad test michl l wittenham pro augm com dno rectori ut supra iesus coll time w welch do,1801,page
1801_5_image,civitati oxon mayors capons curia hustings edi christi receiver do subtreasurer coll omn anim coll ball coll d i bapt arch deaconis procurations supervision dificiorum 2 5 janitorii bibliothecario dep pro anno mitchelli pens per anno biblect c pro 5to octobris concionatori mr kingdom vicar of merton a year to michl so hewington do do pauperibus postage stamps carriage c land tax north half to l day 1801 house window tax do university marshall orn bries the year,1801,page
1801_6_image,5 mr rigand for appociation 16 parish rates from april last 26 mr glubb burar aprov d days omitted in his acct dec 3 paving lighting tax to mids cast tom dodd for lamps a year mar 3 w purdue for nov 2 dec 19 26 mr judge 15 hewitt s bill for l wittenham mr hart burra decrement at xmas 23 dr cole wine bill domus c eaton xmas l day 25 insurance gll 14 a l with 1 1 6 29 taxes to st michael s parish apr 6 income tax for coll the whole year to apr 5 may 11 w fisher for going to value the timber may 19 mr williams bill in lieu of candles june 25 mr glubb s expenses in surveying benson june 28 dr cole downes w bill mids d padbury s bill for a buttery book hays bill for do act books last year mr rigand balance for association tubb s bill for circle for stamps july 1 three poor rates to st michl parish subscription to infirmary for 1802 oct 30 wm purdue domus bill denson gardener bill in full bolton plumber do leach carpenter do hewlett plasterer do bush ironmonger two years fletcher grates c lock silversmith do knowles mason do greene painter do davies blacksmith do hayes buttery books c this year tubb carrying rubbish c newman wire worker polley for two coal sacks mr harris the last payment of the for the rectors lodging,1801,page
1801_7_image,arrearagia recepta recepta anni praesentis bankers receipts recepta varia debit anni praecedentis summa receptorum dno rectori scholaribus et officiariis soluta ordinaria varia deficiency of rector s stipend summa solutorum ex receptis deductis solutis rest solvendi,1801,page
1801_8_image,gwinear rectory a year half menheniot do kidlington do two years do capons brown lucas eaton five years bampton two years mountacute six years jesu college hertford college five years kemp s martins four years padbury st mary magd three years trelkewin a year half wild arish back gate coppin lad lane comptor do hardy do pickford medenham sr gregory p turner leverett s close w gardiner hesteri two years do evins two years timber two years beck five years barnwell two years leonard two years curnock five years,1801,page
1802_1_image,gwinear rectory half a year menhennist do two years kiddlington do three years lucas eaton bampton three years morintacute seven years jesus college two years hertford college six years kemp s martin two years welch s mary magd trethewen a year half wild frith two years backgate coppin lad lane comyns two years do wilton two years do halifax two years medenham two years sr g p turner leverett core gardiner hesters three years do evins s three years kimber three years beck six years banwell three years leonard three years curnock six years,1802,page
1802_2_image,long wittenham rectory so newington do merton do yarnton do and tent chace hill kidlington mills garsington sadler do truin tintinhule napier do beaton seven years clifton terry bensington so newington tent taylor three years judge three years irons three years gardiner burdon s three years hartley three years,1802,page
1802_3_image,gwinear rectory half a year menhenniot d two years kidlington d three years lucas eaton jesus mese two years trethewin a year half back gate coppin lad lane conyns two years d wilson two years d halifax two years mendenham two years j g p turner leveretts close gardiner hesters three years d ewens three years kimber three years beck six years banwell three years leonard three years curnock six years so hewington rectory yarnton d and tent kidlington mills garsington sadler d trum clifton ferry bensington little jew taylor three years judge three years irons three years gardiner burdens three years hartley three years recepta anniprasentis gwinear rectory half year to l day kidlington capons brown d vicarage trethewin half year to l day kidlington augmentation garsington sadler year to l day d trum,1802,page
1802_4_image,nov 11 d shortridge s benefaction to mich r 1802 dec long wittenham rent to mich r last 1803 mr martin s acct for merton viz mar money rent to mich 1802 26 corn rent do land tax leverett s close balance received may merton timber money t g 81 12 13 d shortridge s benefaction to christmas 24 of mr hall for the garden in s t peter le bailey june 22 of the subrector mr keating s plate money do mr michele s do 29 of mr heyer mr grantham s do by d r dean s fees to domus 30 by mr glubb bursar increment mich l 1802 oct 31 by mr heyer for the library,1802,page
1802_5_image,long witherham div to l day 1802 do michl do stipend ad test nati et officiariis augmant s newington merton stipend dno thiers augm com capellanis do rectori ut supra merton div to l day 1802 do michl do ad stipend ad test annu fet skiddington augm pro 3d anni partibus annun dno rectori ut supra time for yarnton from mr chest ad stipend et officiaries fet dno thiers d j augm com moderation et subdecanus bapt skiddington augm pro 4ta parte anni dno rectori ut supra ad guinean stip ad test michl fet l witt pro augm com michl dno rectori ut supra mr knapp s time for kidlington yarnton do hodges do for overthwin wells do clifton ferry beck s do little tew taylor do do hartley s do bennetts do guinacan 1436 8 1 2,1802,page
1802_6_image,civitati oxon mayors capons curia hustings aedi christi reciever do sub treasurer coll omn anim coll ballist coll d i baptiste arch deacon s procurations supervisionum edificiorum per theip janitori bibliothecario dep pro anno mitchell s pension do billect de pro 5te octobris concionatori majr rodd vicar of merton a year to michl south hewington do do pauperibus postage stamps carriage c c land tax to l day 1802 for north hale house and window tax to d for lodgings university marshall corn dries the year,1802,page
1802_7_image,nov 4 paving lighting tax to michl 24 overseers of st mich 4 poors rates 1803 feb 3 do 3 poors rates l wittenham repairs mar 17 to mr hart decrement x mas militia gaol tax st michl 21 wm purdie mr judges bills scarsbrook for a bellrope 22 college subscription to the infirmary ths dodd for lighting the lamps a year 31 insurance college wittenham ap 5 domus wine bills x mas lady day lucas eaton june 30 rutts bill for surveying benson mr ghubb domus wine bill mid july 1 tubbs bill for lamps c the last season purchase of 491 2 7 3p cent consols of mr reeve 11 expences of the progress mr rosdew oct 29 leach carpenter s bill wittenham repairs bolton plumber do benson gardener do knowles mason do parvier smith do hewlett plasterer do 31 polley s bill for sack hayes bookbinder do tubb rubbish lock goldsmith greene painter,1802,page
1803_1_image,recepta anni presentis bankers receipts to next year recepta varia debit anni praecedentis summa receptorum dno rectori scholaribus et officiariis soluta ordinaria varia deficiency of rector s stipend summa solutorum ex receptis deductis solutis rest solvend a dno computante h richards rectorem j cole subrectorem tho smythelubb burs sen sam hart burs jun j l heyes decanum j roodw a m,1803,page
1803_2_image,gwinear rectory half a year menhenniot do rilldington do lucas eaton bampton four years mountacute eight years jesus college hertford college seven years kemp st martin s three years welch st mary magd two years trehewin half a year wild arish three years back gate coppin lad lane comyns do wilson do hallifax medenham leverett s close j g r turner kimber w gardiner pr hester s do evans s beck banwell leonard curnock friddlington vicarage a quarter of a year do rectory do long wittenham rectory do,1803,page
1803_3_image,long wittenham rectory south newington do merton do yarnton do and tenement chace hill two years kidlington mills garsington sadler half a year do truin half a year tintinhull napier two years do beaton eight years clifton ferry bensington south newington tenement two year taylor wm judge richards irons w gardiner for burdon s hartley,1803,page
