unit_id,doc,year_ref,unit
1839_11_image,brought over of mr dawson incrementum domus recd 1838 846 11 office of billect reimbursement to domus for repairs of st tewington 1 yr 1 2 to mich 1839 rector s prize 2 years 1838 omitted 1840 of mr jewell dean s fee one year to mid r 1840 rector s share of gad,1839,page
1839_1_image,br t over yarnton rectory 1 yrs chase hill 2 yrs clifton ferry 1 yrs garlington clenkard 2 yrs little tew taylor 1 2 yrs worley 3 yrs kimber 3 yrs eden 3 yrs hirons 3 yrs hartley 3 yrs recepta anni praesentis gwinear rectory kidlington do do capons brawn do vicarage hart hall st martins tenement kidlington rectory do vicarage long wittenham rectory yarnton rectory kidlington augmentation l wittenham rectory yarnton do chase hill little tew timber,1839,page
1839_2_image,mr falconer incrementum domus to xmas 1838 do office of biblect dr shortridge s trustees one years rent charge to xmas 1838 mr wightwick 1 4 of improved rent of old lane one year to michs 1838 do do medkham one yr to xmas 1837 interest on shrubbs deposit mr dawson incrementum domus michs 1839 do office of biblect reimbursement to domus for repairs at sh newington deducted from rent 1 yr to lady 1838 deans fees 1 yr to midor 1839 mr jewell rev c dagman last instalment on loan for barn at little yew rectors prize 1839,1839,page
1839_3_image,stipend ad festum nativ 1838 page 50 augment s newington merton 51 stipend dno thiers 52 augment comm ejusdem dno et capellano 53 dno rectori div merton ad fest annunc 1838 54 id ad fest s mich 79 stipend ad fest annunc 1839 60 augment kidlington pro 3bus anni part 61 dno rectori ut supra stipend ad fest s johan bapt et offician 71 id dno thiers 72 augment comm ejusdem dne mod et subdec 73 id kidlington pro 1 4 anni parte 74 dno rectori ut supra stipend gwinear ad fest s mich 76 augment comm de littleham longa 77 dno rectori ut supra 715 12 4,1839,page
1839_4_image,civitate oxon curia hudings adis hli bursar coll omnim anim coll balliol coll d jo bapt supervisors adificiorum janitori concionat ad fest consecrat 1838 eidem pasch 1839 vicario merton ad fest annum 1839 ad fest s michl vicario s newington ad fest ann 1839 ad fest s michl assessed taxes for the lodgings april 1839 do octr land tax for the city premises h d 1839 river water from the city works insurance of the coll to xmas 1839 do kidlington school to midsom 1840 gas lights 1 2 yr to l day 1839 do michs 1839 infirmary 1839 grey coat school aines 1838 kidlington do do sth newington do do little tew do do marnton do do merton do do e wittenham do do gwinnear do do,1839,page
1839_5_image,soluta ordinaria brot forward smalle livings in diocese of oxford university marshal bell ringer chapel clerk corn prices easter offering parish rates viz 6 at 2 10 each synodals procurations college gardener 1 dr to xmas 1838 stile 2 dr to lad day 1839 3 dr to midr 4 dr to micha widows orphans of the clergy of the division 408 3 4 mr kimber bill for repairs mr sewell portrait of sir j fortescue baxter for printing exor of late rector value of linen china glass etc in the lodgings parker for prize books stamps for receipts francklin bill for repairs little lew mr ley 1 4 yr int to the library due at michs 1838 at 3 1 2 per cent do do at michs 1839 do do error on ye balance of last yrs acct vide increment domus entry feb 3 bankenbts to 5 per ann pd by late rector for kiddle s gardens 2 1 2 yr to the dives intrst recd by him mr spranger bill for repairs of his rooms subscription to st michs school turner for inkstand given to sir jacobson cooper bill for repairs at garston city of oxford fine for renewal of premises in broad st stamps text c for do 917 14 2,1839,page
1839_6_image,soluta varia brot over gosling repairs at campsfield new tithes bill bill repairs at campsfield mr walsh legal charges under dr jones will mallam valuing furniture in rectors lodgings bill for repairs at little tew do allowed to gardner do do kimber do smith grover fine fees on renewal of bushey tenements stamp for dth on hammons c mr loy progress acct 1839 exor of late rector miscellaneous articles in the lodgings mr davenports bill 1 yr to novr 1838 mr darrington subscriptn to organ mr nicoll do 2 yrs intt on 200 at 4 1 2 ct to xmr 1839 mr loy progress acct to kiddington rectory c grove for venison 1839 insurances yarnton little tew expenses attending funeral of late rector additional charges open scholarships 1 yr to midr 1839 by mr phinn daligairns morton bill for repairing barn at garsington do repairs at the newington interest on mr smithes deposit do for clerk of the market gratuity to mr ports son by order of late rector for 5 years at 1 0 0 pr ann mr walsh s general bill for 1839 mr davis balance of acct to july 3 1839,1839,page
1839_7_image,soluta varia brot forward evans builder knowles mason watts painter rowell lock maker pilcher iron monger cripps fruiterer cuff plasterer do rectors lodgings harpes batley booksto dudley bowler plumbers hobdell silversmith spices stationery basten printing criter herald office advertisements journal dr do walker water plugs domus wine battels h purdue mr underwood architect rectors allowance for kitchen 10 left by 5 1 11 pilchers bill pd by coll compensation to fellows for dry piece wetenham 1gs hds 1758 rectors improved stipend do for letters parcels subrector for detters do deficiency of salary,1839,page
1839_8_image,arreagia anni praesentis varia debita anni praecedentis summa receptoram dno rectori schol c ordinaria varia ex receptis solutis deductis restat solvendum j l richards rectorum edwd dayman subrectoram g dawson bursar senr g jewell m a decan c l cornish s t b john ley bursar junr,1839,page
1839_9_image,menhenniot rectory 4 years kidlington do 1 2 year do capons brown 1 2 year do canal 3 yrs montacute tenement 3 yrs 1 yr recd lad lane norris 1 year donnithorne 1 year pickford 1 year medenham 2 yrs 1 year recd little tew becks 1yr 1 2 yr recd bushey tenements 1 yr waldron do 7 yrs kidlington rectory 1 2 yr long wittenham do 1 2 yr do vicarage 1 yr yarnton rectory 1 2 yr kidlington augmentation 1 2 yr long wittenham rectory 1 2 yr st newington do 1 1 2 yrs morton rectory 1 yr land tax deducted yarnton do 1 2 yr chashtile 1 2 yr clifton ferry 1 yr garsington clinkard 2 yrs crooke 2 yrs,1839,page
1840_1_image,stipend ad festum natv 1839 augment s newington merton stipend dno sheirs augment com equidem dno capellanos dno rectori dis merton ad festum annum 1839 id ad festum st michl stipend ad festum annum 1840 augment meddlington pro 3ma annu partibus dno rectori stip ad festum d joan bapt offic id dno sheirs augment com equidem dno mod subd id meddlington pro 4ta parte ann dno rectori stip guineas ad festum s michl augment com de wittenham longe dno rectori ut supra pro finibus beaton pro finibus scroggs pro finibus eden,1840,page
1840_2_image,wm cox curia hastings adis a te bursario coll omn m animaram coll balliol coll d j badblit reparatori aedific i janitori concionatori ad festum pentecost 1839 eidem pasch 1840 vicario merton ad festum annun eidem ad festum st mich l vicario s newington ad festum annun eidem ad festum st mich l unexped taxes for the lodgings april do october land tax for the city premises l day 1840 river water from the city works do mech insurance of the coll st mas 1840 do redlington school c to midr 1841 gas light to l day do emas infirmary 1840 grey coat school x mas 1839 redlington do do stk newington do do little tew do yarnton do merton do l wittenham do gwinear diocesan board of education 1839 1840 small livings in diocese of oxford widows orphans of clergy do,1840,page
1840_3_image,b t forward university marshall bell ringer chapel clerk corn price easter offerings st michaels poor rates synodals procurations college gardener 1st do to xmas 1839 2d do to lady day 1840 3d do to midsumr 4d do to michs open scholarship to messrs mr phinn mr dalgairn mr morton mr powles gratuity to stringer farther to newington allowance for draining according to resolution of committee king bedlington for repairs in chancel at golings farm gratuity to d reed cooper repairs at garnham timber allowance for shooting mr glubb agent agency to micks 1837 commissioners for having c on opening drain into culvert stile for repairs at garndon mr dawson expenses attending journey to berfleet legal opinion c act of mr shrubbs deposit annuity of hon mill c stile cleaning his stable faukhner bill for repairs of pump osborne for bridge or burgan farm do repairs at carpsfield altering gate in the drawing room of the lodging according to coll resolution,1840,page
1840_4_image,soluta varia brought forward gough repairing prayer books repairs at little tew sub rector expenses of journey to fetch hole streams mr parks mark 24 7 mr dawson journey to london relating purchase of the slip stone king repairs at garston west cornwell repairs of merton tunnel franklin d s repairs chatty bill for lock keys of b k gate removes 1 2 a load of poles hawkins for mr maynard s picture mr dawson journey to trowbridge to buy the purchase money of stile is gone repairs at st newington subscription to gasington school july 10 1839 omitted in last years acct balance due thos davis for glazing etc clarkard allowance for repairs sub rector furniture of mr broadhaws room beater s bill for printing mr mayes bate bill for planting church yard labour repairs mr leg journey to kidlington etc parker prize books goose for venison insurances garston tew stamps mr leg money advanced to franklin on acct of rednal town at kidlington purdue s bill doms wire batchels mr welsh s genl bill mr evans builder hayes bakery books etc cripps confectioner,1840,page
1840_5_image,soluta varia broght forward dudley bowler caff masten herbert pilcher gile harples watts gas company laying new pipes hickman shier robdell sherald new barn floor at clearkinhull leffy stumpf mr underwood mr ley rate to library to michs 1840 rectors allowance for kitchen compensation to fellows for dry piece long withinghan 1 yr michs 1829 rectors improved stipend,1840,page
1840_6_image,arrearagia anni praesentis varia debita anni praecedentis summa receptorum dno rectori scholi c ordinaria varia e receptis solutis deductis restat solvendum,1840,page
1840_7_image,menheniot rectory 1 year kiddlington do 1 2 year do capons braun 1 2 year lad lane norris 1 year donnilthorne 1 year pickford 1 year medenham 1 year little tew becks 1yr x 1 2 bushey tenements 1yr kiddlington rectory 1 2 year long wittenham do 1yr do vicarage 1yr yarnton rectory 1 year kiddlington augmentation long wittenham rectory sth newington do 1yr merton rectory 1yr land tax deducted yarnton rectory 1yr chase hill 1 2yr clifton ferry 1yr bensington 8 yrs,1840,page
1840_8_image,brought over garsington clinkard 1 yr tretthwin 3 yr little tew taylor yr kimber yr dunkirk rent 1 yr medenham 1 yr lad lane 1 yr gwinear rectory 1 yr kidlington do yr do copons brawn yr do canal nil do vicarage 1 yr hart hall 1 yr st martins tenement 1 yr kidlington rectory yr do vicarage 1 yr long wittenham rectory yr yarnton do yr kidlington augmentation yr long wittenham rectory yr yarnton rectory yr chase hill yr little tew kimber yr,1840,page
1841_10_image,bl 300 of bursar pro bibled reimbursement to domus per guineas due of bursar incrementum domus do pro bib bal philibert for furniture in mr mathews room co f soliciting dr horridge s benefaction to xmas 1841 salt in stubbs deposit rectors prize 1842 rectors share of gas deans fees reimbursement to domus for repairs of st nichs 19 march 1841,1841,page
1841_1_image,anonymous for the augmentation of small livings of bursar incrementum domus xmas 1840 do office of biblect error by subscription to a new school charged last year wrongly anonymous donation per r j stranger in aid of bible clerk s office rev g dawson his share of merton fine of the bursar incrementum domus midsr do office of biblect anonymous for the augmentation of small livings 2nd benefaction dean s fees of mr cornish anonymous for the augmentation of small livings 3d benefaction of dr shortridges trustees to xmas 1840 interest on shubbs deposit reimbursement to domus for repairs of st newington 1yr to michs 1840 rectors prize 1yr to xmas 1841 rectors share of gas,1841,page
1841_2_image,stipend ad festum nativ 1840 p128 augment s newington merton p129 stipend dno shiers p130 augment eiusdem dno et capellano p131 dno rectori div merton ad festum annun 1840 p132 id ad festum sti michaelis p144 stipend ad festum annun 1841 p136 augment kidlington pro 3 anni parti p137 dno rectori stipend ad festum d io bapt et officiariis p146 idem dno shiers p147 augm con gusdem dno moderatori et subdecano p148 idem kidlington pro 4to parte anni p149 dno rectori stipend gwinear ad festum sti michaelis p151 augment comm de wittenham longa p152 dno rectori ut supra pro finibus trethewin p142 merton p150,1841,page
1841_3_image,curia hustings adis xlti bursar coll omn animarum coll ball coll i jo bapt supervisor ad f janitori concianatori ad festum consecrat 1840 eidem pash 1841 vicario merton ad festum annun eidem ad festum ste michael vicario s newington ad festum annun eidem ad festum ste michael assessed taxes for the lodgings april 1841 do octr land tax for the city premises river water from the city works insurance of coll to xmas 1841 do kidlington school to midr 1842 gas lights yr to lday 1841 do to muchs infirmary 1841 grey coat school to xmas 1840 kidlington do do st newington do yarnton do merton do l wittenham do bensington do gwinear do diocesan board of education 1841 small livings in diocese of oxford widows orphans of clergy do to the university marshall bell ringer chapel clerk corn prices,1841,page
1841_4_image,brt forward easter offerings parish rates synodals procurations college gardener 1st dr ames 1840 2nd dr day 1841 3rd dr meds 1841 4th dr michel 1841 opera scholarships viz mr morton mr powles mr fulgairns mr courten hill care of stable cooher repairs at yarston shouth interest on deposit do one moiety of hoon price illegible crossed out entry illegible crossed out entry do procurations synodals 2yr to michs 1839 franklin 2nd instalment on diddlington rectory 150 dunbirk ch endowment gardener j w repair draining do keep of dr jones mare 2 yrs 28 weeks x rowell care of stock for the year 1840 mr barnes bill for commutation of fine supplement of stipend to vicar of neston from rents bricks provisional do from mr bidd to xmas interest on 1500 voted by ch for augmentation of neston from novr 1840 to mar at 3 1 2 delapidations on neston for mr w h the made by trustees responsible by their vote tile repairs at campsfield do at yarston franklin 3rd instalment on diddlington rectory 100 hewett fores in diddlington parcel slater advertising dillysheets,1841,page
1841_5_image,bt forward int t on 700 for merton vicarage 200 having been added by i a bowly from xmas to l day at 3 1 2 p ct vicar of weston to of provisional stipend from l day franklin 1 st instalment a redlington rectory cooper repairs at lgarston reed stamps mr guest charges on ac review timber allowance sodraining ditto letter subscription to dudley school one moiety of bill for taking wood at redlington franklin st newton other bills 1840 1841 for draining sub rector difference of furniture in mr tom s rooms dare valuing redlington mills gardens mr woollcombe charge for whitewashing other things franklin 5th instalment a redlington rectory first instalment a colonial dioceses subscription cash on acct groose venison haines for mr ford s prize books mr shephard provisional stipend from l day 5 march 1841 shrubb for repairs at bensighton franklin balance of acct for works done at redlington rectory pilcher gill for fixture for do pilcher gill herald advertising fellowship c knowles evans dudley bowler braithwaite herbert,1841,page
1841_6_image,bf forward jayers waller vickman lambert rawlings spiers 215 13 4 cripps 197 3 7 pardue s bill 412 16 11 wine bottles domus mr welsh general bill mr underwood stringer horse hire 8 2 ret stamps 3 mr dey interest to liby to michs 1841 rectors allowance for kitchen compensation to fellows for dry price long wittenham to michs 1840 1 year rectors improved stipend postages for 2 years viz 1840 1841 baxter s bill for printing,1841,page
1841_7_image,arrearagia anni praesentis varia debita anni praecedentis summa receptorum dno rectori schol or ordinaria varia ex receptis solutis deductis restat solvendum j a richards rectorem e a dayman william sevele ad joannem key b d curar sen william w wollcombe a m william andrews d d,1841,page
1841_8_image,kidlington rectory yr do capons browne yr bampton rents 5 gr montacute 4 gr lad line norris 1 yr donnithorne 1 yr pickford 1 yr medenham 1 yr little tew lymall 3 gr bushey rents 1 yr kidlington rectory yr long wittenham rectory do yarnton rectory yr kidlington augmentation yr do mills gr long wittenham rectory gr st newington do 1 gr do tenement 3 gr merton rectory 1 gr land tax deducted yarnton rectory gr chase hill gr clifton ferry 1 yr garsterton chichards 1 yr tintinhall penny 3 gr beatley 3 gr,1841,page
1841_9_image,bt 700 little jew worley 3gr kimber 2 gr eden 3 gr hartley 3 gr will crick 2 yrs c to midlet 1841 deducting receiver s salary medenham cwm 1840 lade lane recepta anni praesentis kidlington rectory yr 3d capers brans 2 gn do vicarage hart hall st martins tenement kidlington rectory yr do vicarage kidlington augmentation yr chase hill yr little jew kimber yr recepta varia mr spranger 4th benefaction in aid of small livings mr falmer money due from him to ye coll on prize bk account mr spranger 5th benefaction in aid of small livings of bursar incrementum domus,1841,page
1842_1_image,stipend ad festum natos 1801 p163 augment s newton et merton p164 stipend dne shiers p165 augment com qu sdon dna st capella p166 dno rectori dni merton ad festum annum 1841 181 id ad festum st michl 181 stipend ad festum annum 1842 168 augment kidlington pro 3tio anni parte 169 dno rectori stipend ad festum d jo baptist officiar 1841 id dna shiers 185 augment com quondam dna modl et subd 186 id kidlington pro 4ta parte anni 137 dno rectori stipend gavricar ad festum st michl 188 augment comm de whitcham longa 189 dno rectori ut supra pro privibus hawkin s newington 180 merton 183 712 6 2,1842,page
1842_2_image,civitati oxon curia hastings aedis st bursar coll om animae coll ball coll d jo bapt supervisor adif janitor concionatori ad festum cons 1841 eidem pasch 1842 vicario merton ad festum annun eidem st mich vicario j newton ad festum ann eidem st mich assessed taxes for the lodgings april 1842 do betr land tax for the city premises river water from city works insurance of the coll to xmas 1842 do kidlington sch to midser 1843 gas lights yr to lady day 1842 do michs infirmary 1842 greycoat school xmas 1841 kidlington do do st newton do do little tew do yarnton do netherton do long wittenham do bensington do gwinear do diocesan bd of education 1842 small livings in diocese of oxford widows orphans of clergy do total boxed,1842,page
1842_3_image,blover the university marshall bellringer chapel clerk corn prices easter offerings parish rates synodal procurations 1st do xmas 1841 2nd do m day 1842 3rd do midr 1842 4th do michl 1842 mr butler mr morton mr coulburn mr pink mr kenwrington 2 yrs int on 200 at 4 p leat to midsum 1841 gratuity to stringer compensation for merton fine 1st moiety omitted in last yr s acct goslings allowance for draining kimber allowance for bricks from oven mr dagman in aid of extraordinary expense incurred in ye management of i jew school still repairs to gorston farm gardner 54 weeks keep of two poor men smith int on deposit do corn rents stipend provisional stipend q dnes 1841 mr harris kingsbridge legal expenses attending conveyances of ground at woodleigh st ives bates trees for hiddlington,1842,page
1842_4_image,31 over oborne 2 bales for timber for rectory house millington rectory do for compsfield farm hill carpenter fencing trees at redlin for mr maddison on acct for sheldon house exchanger mr m r for provisional l oxford dayton fathers whitewashing work c mr smith by resolution of comm arrowsmith for planting trees at rectory kidd procureations deddington rectory allowance to mr young for rent of house according to comm resolution nov 13 1841 clinchard labour of thatching house gosline draining tiles mr hayner cleaning ditch new plantatio chase hill kimber half the expence of draining do poles 15f line c fulham repairs c cooper bill for paving stoves compensation for master bone for surety to mr mr shephard for provision stipend mch 1842 mr andrews expences of progress graham for mr green s prize books mr dayman for furniture mr hutchinson land purchased of mr tuscombe annexed to living of woodley subscription to handborough church do in l s of prince of wales mr lambert coling bushey tenements progress to merton bampton mr poole gratuity to his son stamps mr shephard his provisional stipend vis mch 1843,1842,page
1842_5_image,share of pintiashull commutation insurance garleston transferred in followings b s d ord do lattle co b s d ord insurances on garleston co omitted in 1841 cash balance of acct baster hayes evans pilcher gish kendal cripps dudley butler shiers powell knowles watts herbert hickman purdue steward of poor hill stable bill donation in aid of restoration of burley c for underwood interest to the library actors allowance for kitchen rector s improved stipend postages compensation to fellows for dry piece in 1845,1842,page
1842_6_image,arrearagia anni praesentis varia debita anni praecedentis summa receptorum dno rectori schol r ordinaria varia ex receptis solutis deductis restat solvendum j l richards rectorem f f searle f s b secrretarium j g townsend s t b bursarium sen w westcombe m a bursarimibus g andrews m a decanum j w morris m a socium,1842,page
1842_7_image,gwinear rectory 1 day menheniot do 2yr kidlington do 1 2yr do copins brown 1 2 yr lad lane norris 1 yr donnithorne pickford redeham 2 yr little tew buckn 2 yr bushey tenements 1yr kidlington rectory 1 2 yr do vicarage l wittenham rectory do vicarage 2yr garnton rectory kidlington augmentation 1 yr long wittenham rectory 1yr chase hill 1 2 little tew taylor 2yrs kimber 1 2 yr st newton rectory 1 yr morton rectory 1 yr ld tax deducted garnton do 1yr clifton ferry 1yr garsington clinkard 1 yr morrell 2 do tinterhull penny 1 yr,1842,page
1842_8_image,tuthewin 2 yrs bt over wild arish 1 yr to midsummer 1842 agency deducts ashfield in tangley 3 yrs to novr 1842 medesham decr 1841 lad lane michs 1842 recepta anni presentis kiddlington rectory yr do cokons brawn do vicarage hart hall st martin s tenrs little tew late becks yr kiddlington rectory yr do vicarage long wittenham rectory yr do vicarage kiddlington augmentation yr long wittenham rectory yr chase hill yr little tew taylors yr kimber s yr,1842,page
1843_10_image,gwineas rectory 1 2 yr 1 day menhenist vicarage kiddlington do 1 2 yr do capons brown 1 2 yr do canal 3 yrs lad lane late norris 1 yr chaplin 1 yr pickford 1 yr predeham 2 yrs 1 yr pd bushey tenements 1 yr waldron do 4 yrs x little few bucks kiddlington rectory 1 2 yr long witterham rectory 1 2 yr yarnton rectory 1 yr kiddlington augmentation 1 2 yr do mills 1 yr long witterham rectory 1 2 yr south newington do 1 yr merton rectory l deducted 1 yr,1843,page
1843_11_image,brought over yarnton rectory 1 yr chase hill 1 2 yr clifton ferry 1 yr bensington 3 yrs tethewin 1 yr little tew taylor 1 2 yr kimber 1 2 yr hiorns 5 yrs wild anstl dunkirk co kent nedesham lad lane kidlington rectory 1 2 yr do capons brown 1 2 yr do vicamage do vicarage hart hall st martins pen waldron do kidlington rectory 1 2 yr do vicarage long wittenham vicarage kidlington augmentation 1 2 yr do mills chase hill 1 2 yr little tew kimber 1 2 yr tethewin,1843,page
1843_12_image,brought over little tew arrears qr balance of rent of cottages tew dunkirk of j gardener tew compensation for legal expences occasioned by him incrementum domus to dec 1849 do do to midr 1844 deans fees reimbursement to domus for guinean fine balance to make up to 230 3d instalments dr shortridge s benefaction to xmas 1843 reimbursement to domus for repairs at st newington brick yard interest on stubbs deposit rector s prize balance returned by mr madden being the difference between the amount of his late father s like for rectory for exchange of 100 advanced by trustees,1843,page
1843_1_image,overcharge on stiler acc allowance to mr young reverted penalty 35 mr sewell dean s fees omitted in last payment of mr kingdon burdon increment donum office of bibliet of mr woollcombe increment donum paid dean s fees caution deposited for keys viz mr tweed mr kingdon mr fonde penshaw poole butler 1 each d shortridge s benefaction to ime 1842 rector s prize 1843 rector s share of gas reimbursement to donum for repairs of the newtons trust 1842 interest on stubbs deposit reimbursement to donum for gwinear fine,1843,page
1843_2_image,stipend ad fest nativ 1842 augment jn martin merlton stipend dna dnashiers augment ejusdem dno et capellano dno rectori div merton ad fest annun 1842 id ad fest st michaell stipend ad fest annun 1843 augment kiddlingta pro 3tia parte anni dno rectori stipend ad fest s jo bapt et officiarii idem dna thiers augment ejusd dno moderatori et subdecano id kidlingta pro 4ta parte anni dno rectori stipend gwircar ad fest st mich augment comm de witteham conga dno rectori pro finibus viz mullingston teurparve,1843,page
