unit_id,doc,year_ref,unit
1752_6_image,pd porter lighting y lamps ye winter lady day corte preis mr thurs augment at xmas mr lawrence in full for candles for 14 load of gravell allowd john davies land tax for 1750 pd collings bill in p p t for candles c cook acct dinner xmas gawdries fees to mr bright for opinions c mr thurs midsummer augment mich corn price pd mr webber mr cooper s battels mich 1740 for a treble opening stays to use ye vacancy of chaplainship by ye dean chapter c hackworth s bills slatters bill joyners bill plumbers bill bills for batting books ink c allowd mr upton for library books cook s bill for mops brooms c scavenger summa receptorum solutorum deb an praecedent retent solut a d computante,1752,page
1752_7_image,longwittonham prov duni an ad mich 1752 merton rect pro train ad mich chase hill trethewan kidlington mills pro hooen garrington sadler mollineux guitinhall napper prov quinquen clarke pro quinquen clifton henry bennington pro duni an ad mich yardington lenen prov an parte an pro rect at mich south newington lenen rect hunter prov an duni gwinner at mich kidlington rect pro an thropp prov septen duni ad mich sues eaton may prov octen leadenhall franklyn pro an pro capon pro an pro leyon herthale jadene conway prov an ad mich minton medenham prov an parte an ad mich munkinith prov duni an mich,1752,page
1752_8_image,wilmot pro trein ad mich pro capon quit rents little tew pro an lord basset lord biggy burdon backgate immer pro dins an wild arish pro trein 4th part ad mich bond of goodch dredgcombe gardington a rect a messs rowney pro 5 janues ad mich 1730 mountacute pro 40 an clps ad mich 1732 webb extrat pro sequestan ab an 1736 greenway ditto pro trein dins ab anno 1734 mason ad test d j b 1742 newman,1752,page
1753_1_image,longwittonham pro dimid ad mich 1752 morton pro frion ad mich frosthwan garsington sadler pro ann molinux pro ann bonsington pro dim ad mich yardington snom rest pro ann ad mich southrowington penn pro ann rest hawtin thorp bush ladonhall jesus coll pro ann grankflyn pro ann pro capon pro anno pro capon hart hall pro an ad mich ladlands conyn pro an ad mich moriton go modsham pro anno minikinest pro dim ad mich backgate emunds pro dim ad mich recpta anni praesentis mynchyvrett rest ad fest annunce 1753 ladonhall jesus coll ad mich 1753 modenham pro anno ad esth nativ 1752 exchequer annuity 1 4 year due ladyd 1753 longwittonham rest ad post annunce 1753 kidlington augm candl received of the administratrix of dr edgcumbe by hands of mr john edgcumbe the sum of ninety two pounds in full for her towards the discharge of yr workmens bills payd by dr edgcumbe in the chapple the whole sum being 184 1 1 received dr dunsamys fees for degrees received of mr bonney for the year 1752 in part received of mr bray library money for mids 1751 553 3 6,1753,page
1753_2_image,received by bill drawn on mr bonny received mr ratcliffes plate money received for an old grate in ye lumber room received mr travaniors plate money received of mr bonny in full for the year to x mas 1752 debitum anni praecedentis illegible short label illegible short label summa totalis receptorum dd an praeced civitati oxon coll ad x t coll adis x t coll comn anim coll ball coll d b mayors capons curice hustings procurations hild i duxington morton easter synodals janitor coques lotrici scull quadrang carbonibus ad wst annuae for nie plumbing chapple after 5th gonsori supervisoris aedificiorum bedell of beggars vorror easter conservation total foot of page,1753,page
1753_3_image,bibliothecarius bib lst 8ber 5th south normington vicar ad inst annue land tax pro ann 1752 stipend pro aug rech d s norvington et morton stipend dna shiers dividend dna shiers stipend another line in same group stipend pro tribus partibus jo kidl augm stipend pro 4ta parte jo kidl augm stipend dna shiers repeat divid dnae shiers stipend pro augm roch jo longwittonham stipend pro augm roch jo longwittonham cont mrs bray pro decorum ad test d d b 1751 share of wm evans fine of gow do of mr edw gurnon fine mrs withington painter s bill from 9ber 12th 1748 pd for knives cloths for the high table pd pittaway smith s bill for work in chapple 1749 c allowed mr bush land tax for six years to lady j last at 4th part for 4 years 3d for 2 years pd mr townsend in part of his bill of work done in the chapple by order of dr edgcumbe being in all 160 12 0 as being by agreement the sum to be paid by his administratrix expenses of the little garden for 2 1 2 years paid for venison for new years day allowed for mr taddon progress pd candlemans corn price paid for wines 5th sep 2d nov last paid the dean mr philips fees civilian wch was put on demy stred a dispute twixt the former present deans total bottom right ledger line,1753,page
1753_4_image,paid molineux brazier bill paid mr combs bill ladyday corn price paid for flooring of room over ye new bursary paid dan collin in full of his first bill of candles paid dod for lighting of winter lamps paid cook acc dinner xmas gaudins paid into ye treasury chest 200 guineas michaelmas corn price paid mr horner for batle books ink paper paid the cook s bill for washing of hall mops c soluta ditto ditto summa totalis solutorum ex receptis quas sunt deb anni praecedentis deductis solutis restant solv a dno computante,1753,page
1753_5_image,longwittonham pro divid ad mich norton pro anno chace hill frothowan pro anno kidlington mills pro drown garrington sadlor pro anno moliners do gintishall napper pro sixenn clarke pro sixenn clifton fery pro biorn borrington pro anno yardington goun pro anno at porto anni rest pro anno j newington venn pro anno rest hawtin pro anno at zin guinsar ad mich kidlington rest pro biorn shrupe bush pro anno at zin ad mich lucas eaton may pro novemn franklyn pro anno pro capons pro anno pro capons pro anno hart hall pro anno ad mich ladslane comyn pro anno ad mich moniston do modingham pro tribus paribus anni ad mich minhamest pro dim ad mic wilmot gos pro quadrinum ad mic pro capons go quit rents of little gow pro biorn ad mich lord myer barret pro biorn ad mic lord olin bigg pro biorn ad mic burdon olin calcott pro biorn ad mic backgate emmes pro anno ad mic wild arish willicomb pro trin at 4 parts an ad mic bond of gooch to dr edgcumbe kidlington vie pro anno bampton pro anno sayer pro anno,1753,page
1753_6_image,yardington rect mr rowney 5 an ad mic 1730 mountcastle pro 41 annis wm catheholt pro inquisition ab anno 1736 greenway catheholt pro birn vin ab an 1734 mason ad inst d j b 1742 newman,1753,page
1754_1_image,longwitttenham pro dim ad mich chace hill dretthern pro anno kidlington mills pro decen yerrington sedes pro an molineux pro an frintinball neppur pro sexen clarke pro sexen bungiston pro anno south newington tenem pro anno rect haustin pro an dim grosvenor ad mich lucas eaton may pro nonen franklyn pro an pro capon pro an pro capon horthall pro an ad mich lad lane comyn pro an ad mich merton ditto minchinner pro dime ad mich wilmot few pro judman ad mich pro capon ditto quit rents little tew pro brin ad mich lord major berket ad mich,1754,page
1754_2_image,lord olim bigy pro bien ad mich buydon olim calcoth pro bien ad mich back gate zunner pro an ad mich dild ansh pro trin 4to parte an ad mich kidlington vic pro an seger pro an myddlewick ad fest annum 1754 lucas eaton half yr to lady day 1754 quit rents little tew wilmot ad mich 1754 capons long wittenham half year to lady day 1754 kidlington augment candlemas capons preason lord haper barrett lord olim bigy pro dim ad fest annum 1754 ad fest mich buydon olim calcoth benington pro dim an ad fest annum 1754 grotten pro dim an ad fest annum 1754,1754,page
1754_3_image,recd mr hellen plate money recd of mr webber burser library midsumr 1751 recd by bill drawn on w smith by ordr of mr bendysshe payable last midsummer recd by bill ditto payable last xmas recd busson library monry mids ending 1749 recd ditto mids half year ending 1748 recd mr northover plate money debs praecedentu anni c the computator summa recept,1754,page
1754_4_image,civitati oxon coll adis xt coll adis xte coll omn anim coll ball coll d i b mayors sport care hosting precurations hid l s kew merton certa syndrals janitori corpo latnei scall quedrong carbonis ad fest annum fest mich cleansing chapel octr 5 consori supravisors edificiorum bridale beggens sermon easter sermon consecration bibliothecans bulls lent octr 5 south neigh vic ad fest annus fest mich land tax pro anno 1753 caste prisoners poster letters c 2 years,1754,page
1754_5_image,stipend pro augm rect d o s kingston merton stipend d na shiers divid d na shiers stipend divid p ro 3 rs part red rent ridding augm stipend div p r 4 te parte de kild augm stipend d na shiers div d na shiers stipend p ro augm rect longwittinham dub 29 p place of longwittiden office march 29 p place of yarnton office may 18 p place of oxon office june 9 p place of denvon swetthaven affairs in all july 8 p place of burdon office little d o may r webber p ro decret at c rt nat 1751 404 7 5,1754,page
1754_6_image,novr 28 1753 pd mr williams to michl cart feb 1 pd other prisoners allowed mr ladon grozep money pd mr doe land tax for ounny house yr 1751 pd scavenger to ap 22 1753 corn price lorde allowed mr powell expenses for sad lane rent pd mr coley bill for candles to april 1753 pd mr townsend in pt of his bill pd mr kenneth for houseguard heb bible mohnings brewry bill pd dodd for lighting yr lamps pd slatern bill to xr 22 1753 corn price lady day pd g sumbard for wine to 5th octr cart ditto 2d novr pd mr doe for binding books for library pd mr payton for serving a bond of mr hill allowed simmons land tax for yr yr 1752 due lady day 1753 pd mr crombey for paper kitchen books pd 2d subscription for taylor heb concordance pd carpenter bill for room in chapple nuns room pd eaton smith for work in library lock key pd mercy gedney for turning forks for high table allowed mr morhead expenses at tritthewon corn price mich pd horner bett bett brooke c pd mr ramsay expenses propog pd cook for golds acct dressed c pd don buttley books mohning brewery in full,1754,page
1754_7_image,thompsons bill boylys bill bolton s ditto yearlers bill pevins bill collins for candley c in full soluta ex receptis qua erant deductis soluti rest solvent a qns rectore competente franciscum webber rectorem jacobum coforat sub rectorem ghanam bray decanum benj kennicott a m robertum ewinge a m,1754,page
1754_8_image,longwittenham pro dein ad mich gordington tenem pro bien part an rect pro bien merton pro bien chase hill grettwen pro dein ad mich 1754 kidlington willa genington sadler pro an ditto molineux pro an gintinhalh nappor pro an clerke pro inquisn cliffton henry pro dein bensington pro dein ad fest mich south newington tenem pro an rect pro an ad dein gwynuer ad mich kidlington rect pro dein thomp brink pro bien dein lucas eaton pro dein ad mich 1754 brooklyn pro an dapon 2th c pro an dapon 2th c hartshall pro an mulignutt pro dein ad mich 1754 ladlane conayn pro an merton pro an medenham pro an az by partionn backgate summs pro an wild arish pro an 4th parte anm bond of grooch to predschimbe,1754,page
1754_9_image,kidington vie pro anno bampton pro then mountacute pro 42 annu seyer pro anno leedenbell pro an exchequer annuity pro an t dem mich 1754 yardington rect pro 5 an admich 1730 chur rowry bell catstreet pro seaquein ab an 1736 greenway catstreet pro bren y dui ab an 1734 mason ad inst d j b 1742 newman,1754,page
1755_1_image,longwithenham pro diem at mich gardington tenham pro frien parte garrington sadler pro an molineux ditto trinitull napper pro anno clarke pro quinquen southesburyton tenant pro s an rect pro an diem gwinner ad mich kidlington rect pro trin lucas eaton pro diem franklyn pro an capon 2 6 pro an capon 2 6 minchinnet pro trin at mich 1754 ladene conings pro an meriton pro an medenham pro an 3d part an backgate dumes pro an wild arish pro an 4th part an kidlington vic pro an bampton pro trin sayer pro an lidinhalt pro an,1755,page
1755_2_image,michimintp rect ad mich 1755 hedleyton vie ad mich 1755 brampton ad fest annum 1755 medculham pro 1 portion ad fest nat longwittenham rect ad fest annum 1755 augment hedleyton paddew capons brown sintinsale mapper ad fest annum 1755 clarke ad fest ditto longwittenham at fest mich 1755 recimd of mr littleton as due to downer for portage recimd of mr bonney due mich 1754 of ditto due xrismas 1754 recimd excheqr anuity due xrism 1754 recimd burtons midsu un presents 1754 recimd of mr bray dean due to down foreg recimd of ditto for heatheotes plate summa receptorum,1755,page
1755_3_image,civitati oxon coll ady xti coll ady xti coll omn anim coll ball coll d j b mayor s capons curia hawking procurat mr j newnton merton easter synods janitori coquo lothari carbonibus ad fest annum ad fest mid clearing clerq octr 5 consors supervisor adif bidel beggars sermon easter consection 5 octr bibliothecaris bihl lect octr 5 south rewington vic annum ad fest mich land tax pro an 1754 castle prisoners bocardo pensinibus postage letters,1755,page
1755_4_image,stipend pro augment rect de south new merton stipend dno shinn divid ditto stipend pro 3a part red rect d hid augm stipend pro quarta part hid augment stipend dno shinn divid ditto stipend pro augm rect de longwittenham paid mr cofferat bursam decemb for michsum 1752 paid mr webber ditto decemb mid 1753 paid mr upton decemb for xpmar 1752 paid fine of kibling fine fine of mr hoppers fine chace hill fine meating sr newington gwineas gd h mills holwells alias hopkins of trinterhook,1755,page
1755_5_image,p d alexander hilfox for ye acct dinner 1754 p d mr payton his fee for keeping court at pew mason ye gardner for setting shrubs in ye g td quadr expences of ye little garden for two years for pension for halse new yeers day a bill of mr wittington painter in full allowd mr sadlears progrefs money lambert wine 5th octr 1754 ditto 2d novr p d for candlemaps v li day corn prix p d mr webber ben from yr 1739 for debt for insolvent debtors p d three men 2 nights patroling ye streets at ye oxf election p d for instruments of game keeper to ant keck esqr p d mr fletcher for a bible for ye chappel ditto common prayer book p d collins bill in part p d mr townsend in full of bill of 160 12 0 allowd summes land tax for ye 1753 p d a kitchen bill of mrs combes to ye treasurer of ye city of oxford for renewing ye leases expences of ye looms at 2 18 4 each allowd ye city viewers in lieu of an entertainment corn prix much p d j smiths fees towards mountacuts lease p d mr rawlins registring ye city leases p d mr dinys disburments for booksellers bills c repaid mr bowles wch he paid too much li day rent p d molinaux braziers bill mr homer butting battle books c dod for lighting last winters lamps cookly bills gandry c cheedon bills in full,1755,page
1755_6_image,p d plummer glazier bill hatton bill carpenter bill smithy bill scavengers bill painter bill wm combs bill summa solatorum summa receptorum deductis solutis deb anni praecedentis summa solvenda a dno computante franciscum webber rectorum jacobum coporat sub rectorum car webber tho bray decanum franciscum upton joannem howell,1755,page
1755_7_image,yardington tenem t pro an parte an rect pro tren morton pro tren chace hill frotherman pro an dim kidlington mills bond arrear garrington sadler pro an molineaux ditto frintenhall napper pro dim an at mich holwell nuper clarke hopkins pro dim an clifton ferry pro quadren bensington pro an dim south new ten pro an rect pro an dim gwinian pro tren 3 d part an kidlington rect pro an thrup pro tren dim lucas eaton may pro an franklyn pro an cap 2 6 pro an cap 2 6 harthall pro tren lodlane conyn pro an merton pro an medenham pro 3 d part an emmer bagbgate pro an wild trisk pro an 2 d parte bond of gooch bampton pro dim an mountacate pro dim ad mich j smith fayer pro an,1755,page
1755_8_image,leadenhall pro an jews quit rents pro an willett pro an capon lord hoper barret pro an lord alias bigg pro an burton alias calcott pro an gardington rect pro an mich 1730 mr rosey 50 catstreet webb pro sequens ab 1736 catstreet greenway pro bien odim 1734 mason ad trust d j b 1742 newman mountecute pro 40 an elapse 1752,1755,page
1756_1_image,merton pro fine gassington saler pro an molineux pro an madax pro an south newington tenem pro an recti pro an dim lucas eaton may pro an franklyn pro an copor 2 6 pro an copor 2 6 ladlane comyn pro an meriton pro an wild arsh pro an 9 q a part sager pro an leadenhall pro an lord nuper bennett minchin,1756,page
1756_2_image,wild anil longwittenham rect ad post annu 1755 ad post mich ditto kidlington augment candlemas capons brosen janry 26 received of mr bonsey by bill due mid 1755 may 4 receivd of ditto due xms 1755 of medenham estate renewed at st thom 1754 yr whole fine 100 coll share 33 6 8 the clut share 4th part june 11 excheqr annuity 1 year 2r due lady 1756 july 26 recievd of mr williams jervis yr ch share for ye sale of timber at medenham aug 31 received of mr evans a deficiency in casting up his four battelds mids 2d cart summa receptorum,1756,page
1756_3_image,civitati oxon coll ady ctt coll ad n xti coll omn anim coll bal coll d i b mayors copors curae hunting procurator kidi south new merton sertor synodalr janitori coquo lotrica scull quadrans carbonibus ad fest annun ad fest mich cleaning chep octo 5th jousori supervisori edificiorum bibliothecario bib lect octo 5th bedell of beggars south newington vic ad fest annun ad fest mich sermon easter consecration sermon octo 5th castle prisoners postage letters,1756,page
1756_4_image,test nat stipendium argument j newton merton stipend pro fhien divid ditto test annum stipend pro past post rect deduct pro 4th part dr ridley augment test d j b stipend pro 4th parte ridley augment stipend pro fhien divid ditto test mich stipend pro augment rect de longwithahem jany 31 1756 magro upton decremt ad prost nat 1753 febry 2 share of minchins time for lords wm estate little few may 9 po share of corbet jodens time juty 31 po share of pr edwd turners time po share of richd judys time of little few octr 23 po share of mr hanham s time,1756,page
1756_5_image,1755 dec 27 pd for venison for ye hall new year day 1756 jan 14 gave carter sick in distress feb 11 candlemas com price 14 allowed mr sadler progress money march 18 pd g lumberd yth octr 2d novr april 5 lady day com price 21 pd mr townrend in pt of bill for cole work from 1749 50 ye 3 first pages viz to march 31 1753 may 4 pd mason gardner for turning up ye gravel of ye quadrang 9 pd cooperat by consent of society for ye use of ye univ university of debrezen in hungary june 25 pd mr townsend more in pt of his bill july 21 pd into ye excise office for 2383 ounces of college plate octr 12 mich com price 19 pd mr doe by mr homer for 2 battery books 24 pd acct dinner gawdye c 26 pd horners note summa solutorum recepta anni instantis deb anni pr cedentis deducti soluti solut a quo comput car webber thom as bray gran upton johannem howle benj kennicott,1756,page
1756_6_image,merton pro an chace hill lord olim biggs pro brien little tew quirt rents pro brien burdow olim calcoth pro brien fotherivan pro brien dim wilmot pro brien copony dittos kidlington mills bond with interest to be added garrington molineux pro an sadler pro an fritinkute napper pro an dim holwell nuper clarke alias hopkins pro ditto clifton ferry pro quinquen benington pro brien dim south newington tenem pro an ladlane comyn pro an merton pro an minchin nuper lord berret pro an yarlington tenem pro brien parte anui rect pro quadrien gwinear pro brien 4th part an mynhennet pro an south newington rect pro an dim kidlington recty pro brien thos bysh pro quadrien dim,1756,page
1756_7_image,kidlington vic pro an luces eaton pro an bampton pro an dien mountacute john smith pro an dni franklyn pro an copon 2 6 pro an copon 2 6 jager olim myn pro an copon y th harthall pro trin leadenhall pro an medeham pro an for port an sumer backgate pro bien wild arish pro hi parte an ad much 1756 yarlington rect rowney cattstreet webb cattstreet greenway mason newman mountacute,1756,page
1757_1_image,garrington molineux pro anno sadler pro an clifton ferry pro an bensington pro bien dim south newington tenem pro an ladame comyn pro an meriton pro an gardington tenem pro bien parte anni rect pro quadrien gurnear pro an minhennet pro an south newington rect pro an dim kidlington vic pro an franklyn pro an capons pro an capons sayen olim mym pro an medenham pro an 3 an part an dimmes backgate pro bien 275 18 2,1757,page
1757_2_image,mynhurvet rect kidlington vic franklyn medeham pro 1ra port an ad fest nat 1756 longwittenham rect ad fest annun 1727 kidlington augment condemas capons brawn bonyngton pro an ad mich 1757 april recievd of mr bonney for the year 1756 30 recievd of mr bray on mr bucks acct plate aug 26 recievd of mr bray dean fees due to bonny from octr 17th 1755 summa receptorum,1757,page
1757_3_image,civitati oxon coll ads xti coll ads xti coll omn anim coll bal coll d j b mayor s capons curia hasting procur r d south newington merton easter synodals janitori cogno lectres seule quafrey corbomby ad fest annum mich cleaning chapel octo 5th fouries edif supervision adif bibliothecario bib lect octo 5th bidel of beggars south newington vic ad fest annum mich sermon easter consecration octo 5th plate excise castle prisoners portage letters pauperibus,1757,page
1757_4_image,stipend augment rect south nunnington merton stipend due flurin divid ditto stipend pro 3d part rect riding augment stipend pro 4th part kidl augment stipend due flurin divid ditto stipend pro augment rect congiutton jan 29 1757 magro upton decrem test nat 1754 decb 16 1756 p dr dumaresq shew of molineux priory octr 1757 p mr shepherd bib lect,1757,page
1757_5_image,nov 24 1756 pd subscription to loop paper by compouners library 30 pd a bill of arthur floyd college work decr 15 allowd mr sedlen progref money jan 1 1757 pd for denison for the hall 19 pd payaters bill feb 8 gave to collection for ye poor 12 cadlinies corn glu 18 lymbarb wine oit ditto 2 nov april pd mr webber burser in cash article of notes in yr burser s books to supply deficiency of money 26 pd collins bill in part for candles lady day rent price 29 allowd mr williams expenses for getting ladline rent may 2 pd mr walker by mr homer for writing 4 letters on coffey business 25 allowd emms land tax for ye year 1754 july 4 little garden expences for 2 yrs half 8 pd mr townsend in pt of his bill aug 12 pd mr comber s bill for kitchen books 26 pd mr berg disbursemts for books c octr 14 pd thompson joyner on account pd cook for gardens acct dinners bills 18 pd brainer s bills for yr 2 last yrs 20 pd scavenger 2 last yrs pd homers note pd plummer glerien 2 yrs bill pd slatters bill for 2 yrs on acct in pt pd smiths bill 2 last yrs nov 1 pd for 2 butley books mich corn price summa solutorum,1757,page
1757_6_image,sc deb anni praecedentij l deductis solutis solvend a quo computante fran webber rectorem pro subrectoze car webber pro decano fran fyston john gardner robertus guringes hen m mounsteven,1757,page
1757_7_image,longwithenham pro dim an ad fest mich merton pro bien chase hill yarlington pro arrear rect decem lord olim bigg pro tren little tew quit rents pro tren burdon olim calcott pro tren trethewen pro tren dim wilmot pro tren capon ditto kidlington mills bond interest to be added garrigton molineux pro an sadler pro ditto fritinhal napper pro bien dim holwell nuper clarke pro bien dim clifton ferry south newington tenem pro an ladlane conyers pro an merton pro an minchin nuper lord barnet pro bien south newington rect pro an dim kidlington rect pro priori thrupp bush pro quinquen dim lucas eaton may pro bien bampton pro bien dim mountacut smith pro bien dim sayer olim myan pro an capon in all horthall pro quadrien leadenhall pro bien,1757,page
1757_8_image,medenham pro 5th part an ad mich 1757 groncar emney backgate pro bien wild arish pro an 4te an ad mich 1757 bond pro ditto pro gooch with interest excheqr annuity pro an dem ad mich 1757 yardleyton rent pro 5 an mich 1730 a mr rowney armig catstreet wells pro sequan ab an 1736 greenway pro bien dem ab an 1734 mason ad sept d i b 1742 newman mountacute pro mountacute annis elapsi 10 1732,1757,page
1758_1_image,longwittonham pro dim ad gust mic yardington arrear pro rect yardington arrear pro gonom wilmot pro prior pro capon kidlington mills mr hills bond interest of ye said bond to april 5th garsington molineux pro ann sadler pro ann clifton porry south nowington gnom pro anno ladlane comyn pro ann moriton pro ann south nowington rect pro ann kidlington rect pro prior lucas edson pro bion sayer olim myn pro ann 5th capons in all loadenhall pro bionn guinar emmons backgates pro ann wild anish pro anno wilmot ad post annunc pro capon longwittonham ad post annun kidlington augmentation at candlemass capons brawn kidlington mills ad post annunc,1758,page
1758_2_image,jan 16th received of mr r laxton vicar of deddington head due last mids april 17th recd of do due last x mas mar 28th recd of mr webber bursar half years incom mont at mids 1755 summa receptorum civitati oxon coll dis xti coll dis x6 coll omn anim coll ball coll d i b mayors capons curia hastings procurations kidd newington merton easter synodals janitors coquo lotrici scull quadr carbonibus ad fest annun fest mic cleaning chappol c 5th gonsons supervisorii dificiorum bibliothecariis bib c y er 5th south newington vicar ad fest annun fest mic sermon easter consecration,1758,page
