unit_id,doc,year_ref,unit
1700_10_image,civitati ozon coll ed s xti 4 duabus annis majors capons coll ed s xti collegio omn animarum coll sti jo bapt coll balliol curie hoystings procura ons coll southn merton janitori coquo lotrici ann 1 mich 7 jonson bibliothecario bibliothecario non graduat bedle of ye beggars scullion and quadrangle pro episcopo m visitaone primaria west supervisor consecraon sermon curate of southn ann 1700 10th mich 1700 10th ann 1701 10th corne priy tenths for merton synodalls southn cudlingt merton frisney bocardo 5 s 5 d castle 5 s 5 d pauperibus agra bibliorum clerico,1700,page
1700_11_image,guinrear pro arro long wittham pro mich mippinnet pro pierris south bewton pro mich merton pro pierris chase hill pro mich thrap pro mich fae quit rents pro mich hardington pro mich ralph marshalls capons calcot pro mich cudlington mills pro mich bampton pro pierris mountague pro quadriennisel diem hughs pro pierris greerway pro mich walker pro mich minne pro mich cauder hale pro plearnie brome pro mich sadler pro mich faber pro mich finchhall rulf pro arro 2 09 hopkin pro arro 12 8 clifton ferry pro arro bersington pro mich brew house south weston ternent pro pierris trelhearn before the lease trelhearn since the lease propinquity merton vicarage pro arro seat common martin 8 harry 8,1700,page
1700_12_image,gu paynter rs jo cooke sub rs geo vernon ric hukins dan thorn sen hen edwards,1700,page
1700_1_image,civitati oxon coll dy chri may capons coll dis chri coll omn animarum coll st jo bapt coll baliol curia hoystings procurationes cudl southn merton biennio janitori coquo lotrici tonsori bibliothecario bibliothecario bibliothec non graduatorum bedle of beggars scullion for keeping ye quadrangle d o episcopo in visitatione sua trien west supervisor consecration sermon curate of southn mich 10 corne prices tenths of merton synodalls cudl southn merton prisonrs in bocardo castle pauperibus aquaduct 1 cock for ye buttery 3 6 setting on ye cock bibliothm clerico sum,1700,page
1700_2_image,aut dinner money baggs to yt gardiner for a days work and nails abt ye bath yard of ye coll to ye james davyes joyner bill to ye wittow vaughan by consent to groves for fewell oatmeal c to rich lumly 2 buttery books paid mr osbourne for wells mapps to dr levet for finding coopers anatomy to mr pain brasier to groves yt cook for xtms new years day epiphany to mr burghers for engraving yt front of ye coll for two basses for yt chappell to mr subrectr adams for preaching for mr vivian to day yt smith for george her taxe ann 6 mich 4 jenningss taxe ann 6 mich 4 to james fifield selater to mrs howard abt ye recomendagn of ye arch bp of dublin to cosens for candles apr 8th 14 octob 4th 15 6 to broadwater for candly for ye buttery to mr hall for printing ye cutt of ye coll front to mr nicolly recommended by ye d of orm by consent to mr clark for 20 subscription parchm s 9 yards of flaxen cloth for towells to mr pontell a french protest abbot by consent to burrows easct to yong ye smith for mending ye lock and two keys to ye library wire for ye hall oct 5th to mr osborn for lettering ye acta eruditoru for cleansing yt yard behind ye lodgings expences thy year in ye coll progresse to mr dodwell his bill for charges in recovering our annuity from thrup letters about colledge business for six years past to mr clark booksellar his bill,1700,page
1700_3_image,calcutt pro mic bampton pro anno montagu pro tridennio dimidio hughes pro anno greenway pro mic walker pro mic mynne pro quadrionnio leadon hall pro anno broom pro mic tintinhull rush pro sesquianno hopkins pro sesquianno clifton henry pro mic bensington pro mic trethowin before the lease trethowin pro tridunio dimidio recd imp 18th merton vic pro sesquianno southbrington tenemt pro anno of wch 3 4 due sepr mr martyn mr harris per nos gu paynter ry jo cooke subs ric hutchins sam adams dan osborn rob rons doc,1700,page
1700_4_image,imprimis redditt comput de remanentib m cista i tem de arragys guinear pro anno longwitenam mich minhinnet anno south newington pro anno merton anno thrup sesquianno the quit rents mich calsah mich bampton mountague at dimidio triennio et dimidio hughes anno greeneway mich walker mich minne quadriennio leaden hall anno tintinhull rush sesquianno hopkins sesquianno clifton ferry mich bensington mich trethewin before ye lease trethewin pro triennio et dimidio reed m p t merton vic prosesquianno gent comoners martin harris brome mich southnewington tenement annos of wch 3d for ye former year guinear longwitenam ann minhinett south newington ann m p 20ts more m full for ann 1701 cudlington rry yardington ann st merton chacrhill ann thrup ann cudlington vicarage lucas eaton,1700,page
1700_5_image,item 50 dr levett for impensa and nota dom nat 1699 item to dr pain for greeneways fine 15s 6d pens fine 1 s 8 ad festum nativ p augm southn et merton stipend et officiarys ad fest ann p augmto rd de cull 3 ptes stipend ad fest bapt 4te pte augm rd de cull stipend et officiarys ad fest mich p aug rd de longwitn solut guinear to dr levett for mr vivians batts mich 99 2 4q nativ 99 2 8 to mr harris for mr vivians batts mich 98 2 4q nativ 98 2 7 for timber for carrying on ye new buildings ye money being given as appears in ye last years aut to ye college by ye most reverend dr marsh ld archop of dublyn and by his consent to be applyed to ye said buildings sum summa omnium receptorum summa solutorum sic debet dns computans sed petit allocari pro romanintibus in cista sic introduxit hoc anno sic remanent in cista hoc anno guinear p anno longwittenham pro mic minhinst pro anno south wington pro anno merton pro anno thrupp pro sefquianno,1700,page
1700_6_image,ralph marshalls capons lord ann 2 0 10 much 1 18 1 calcott ann cuddington mills ann 4 14 11 bampton mountague hughes greenway ann 10 walker ann 6 6 franklyn ann and mich minne ann harthall leaden hall brome ann 2 7 5 sadler ann 2 4 5 tintinhull rush hopkins clifton ferry bensington ann 1 16 11 brewhouse southnewington tenem cuddington augm red ad fest purificationis frethewin before ye lease frethewin since ye lease merton vicarage ladlane m sparks and merit on ann 17 13 4 medenham bapt and st thomas backgate george ann 2 mich 2 jennings ann 2 mich 2 rec of m verman for batts due to ye coll and for so much p to m berry ye brewer rec of m hutchins bursar for increments rec for gent comoners of m vincent 8 m treby 8 m m arscott 8 m baber 8 m for act supper w m lane 2 m marker 2 ballts for eggs saturday and ashwednesday st potbury 2 st orchard 2 st gee 2 st pennington 2 rec of m hutchins for ye comons library rec of m hutchins for increm for year july 16 1701 rec of m hutchins for ye comons library,1700,page
1700_7_image,sue quitrents ann ralph marshalls capons lord ann 2d 0 10 mich 1 18 1 calcott ann cudlington mills ann 4 14 11 hughes greenway ann 10s walker ann 6s6d franklyn ann and mich minne ann harthall leaden hall brome ann 2 7 5d sadler ann 2 4 5d tintinhull rush hopkins bensington ann 1 16 11d brew house cudlington augm red ad fest purificatonis trethewin before ye lease trethewin since ye lease merton vicarage ladlane mr sparks and merit on ann 17 13 4 medenham bapt and st thomas backgate george ann 2th mich jennings ann 2th mich reed of mr verman for batts due to ye coll and for so much pd to mr berry ye brewer reed of mr hutchins bursar for increments mr vincent 8th mr treby 8th mr davie 8th mr arscott 8th mr baber 8th mrs for act supper with mr lane 2th mr marker 2th batts for egy saturday and ashwednesday sr potbury 2th sr orchard 2th sr gee 2th sr pennington 2th reed of mr hutchins for ye comons library reed of mr hutchins for incremts for year july 16th 1701 reed of mr hutchins for ye comoners library,1700,page
1700_8_image,4 money baggs and files to cognus for fewel c to collison carpenter from febr 16 to nov 8th 99 700 to west book binder for mr wells his mapps to eldradge for 29 load of rubbish 3 load of gravel and 1 of mold to james hilleard glacier to mr verman on his restoraon to ye profits of his fellowship past by ye visitor s order lost by ye fall of guineas put into ye chest 1698 to boyer for for work in ye back quadrangle to mr rothwell a minister by consent laid out by mr hutchins for ye comoners library to cognus for chtms new years day and epiphany dinn for stampt paper and a citaon agst paynter for 3 horses and chargs in going to hamborow to ralph cox for gasses and matts for ye chapell more to him to day ye smith march 15th for two money baggs to cosens for ye chapell ann mich to broadwater for ye buttery for a year to pain ye brazier to hifield ye slater george 4r 6r mich 6r jennings 4r 6r mich 6r to james davies joiner for 3 horses going to longwitnam and charges for visiuing ye chancell to jo halifax ironmonger for nails c abt ye house of office to townsend ye mason from apr 29 99 to may 31 1701 to mrs edwards towards ye rebuilding of ye south end of ye vicarage house of kidlington by consent for buttery books at nat and bapt to fra bugge by consent for mr rennells mine and my mans journy to slyfield abt ye and other estates given ye coll in reversion for 4 horses 6 dayes for ye journy for wedding and cleansing ye rood yard to mr clark bookseller for auditing books paper c for 10 qrts of red gallitia oct 5th 1701 to will day smith novembr 1st 1701 to james hilleard glacier collison carpenter 32j 16s 6ob 34 10 10,1700,page
1700_9_image,to mr adams impensa coll et nota dom nativ 1700 to mr hutchins nil to do pain for longwtn fine ad fest nativit pro augm red southn et merton stip et officiarijs ad 1st ann pro augm red de cudlings 3 ptes ad fest bapt pro 4ta pte red augm de cudding stipend et officiarijs ad fest mich pro vel augm de longwtn soluta p guinecar item pd for batts for mr nivians batts ann 1700 27 d bapt 1700 27 11 for do huthnance batts mich 93 1 1 1dq nativ 1693 3 2 to blake mich 1701 to pearse mich 1701 to jago mich 1701 to mr hutchings for do parsons batt ann 1700 bapt 1700 item for mr harris bapt 1701 summa omnium solutorum 569 14 4 line under subtotal likely summa omnium solutorum repeated summa omnium solutorum repeated fir debet dus computans mem quod se 375 18 n anno superiori in rista remanentibus soluta fore magzo doman fir introducant hor anno fir remanent in cista hor anno,1700,page
1701_1_image,imprimis redditt comput de remanentib in cista item de arreragy s guinear pro anno longwitnam mich minhinnett p anno southnewington pro anno merton p anno thrup p sesquianno tue quit rents mich calcott mich bampton mountague nec p of dimidio p triennio et dimidio hughes p anno greeneway mich walker mich minne p quadriennio leaden hall p anno tintinhall rush p sesquianno hopkins p sesquianno clifton ferry mich bensington mich srethewin before ye lease srethewin pro triennio et dimidio reed in pt merton vic pro sesquianno gent comoners martin harris brome mich southnewington tenement p anno of wth 3s 4d for ye former year guinear longwitenam ann minhinett southnewington ann p 20s more in full for ann 1701 ludlington rry yardington ann st merton chacehill ann thrup ann ludlington vicarage lucas eaton,1701,page
1701_2_image,jue quitrents ann ralph marshalls capons lord ann 2 d 0 10 mich 1 18 1 calcott ann cuddington mills ann 4 14 11 bampton mountague hughes greenway ann 10 r walker ann 6 6 d franklyn ann and mich minne ann harthall leaden hall brome ann 2 7 5d sadler ann 2 4 5d rush hopkins clifton ferry bensington ann t 16s 11d brewhouse southnewington tenem t cuddington augm red ad fest purificatonis trethewin before ye lease trethewin since ye lease merton vicarage lad lane m r sparks and merit on ann 17 13 4 medenham bapt and st thomas george ann 2 t mich 2 t jennings ann 2 t mich 2 t 125 18 10 ob reed of m r hutchins bursar for increments recd for gent comoners of m r arscott 8 t m r baber 8 t m r for act supper and m r lane 2 t m r marker 2 t balce for eggs saturday and ashwednesday s r potbury 2 t s r orchard 2 t s r gee 2 t pennington 2 t recd of m r hutchins for ye comons library recd of m r hutchins for increm ts for 1 2 year july 16 th 1701 recd of m r hutchins for ye comoners library j iis,1701,page
1701_3_image,civitati oxon coll edis xti q duabus annis majors capons coll edis xti collegio omn animarum coll sti jo bapt coll baliel curie hoystings procuraons cudl southn merton janitori coquo lotrice ann 1 mich qt tonsori bibliothecario bibliothecario non graduat bedle of ye beggars scullion and quadrangle 2no episcopo in visitacone primaria west supervisor consecraon sermon curate of southn ann 1700 10s mich 1700 10th ann 1707 10s corne priy tenths for merton synodals southn cudlingt merton prisng bocardo 5s r castle 5s r pauperibus agard bibliorum clerico,1701,page
1701_4_image,4 money baggs and files to cogus for fenel c to collison carpenter from febr 16 to nov 8th 99 700 to west book binder for mr wells his mapps to eldradge for 29 load of rubbysh 3 load of gravel and 1 of mold to james hilleard glacier to mr yerman on his restoration to ye profits of his fellowsp past by ye visitor s order lost by ye fall of guineas put into ye chest 1698 to boyer for for work in ye back quadrangle to mr rothwell a minister by consent laid out by mr hutchins for ye comoners library to cogus for chrms new years day and epiphany dinner for stampt paper and a citaon agst paynter for 3 horses and chargys in going to hamborow to ralph cox for gasses and matts for ye chappell more to him to day ye smith march 15th for two money baggs to cosens for ye chapell ann mich to broadwater for ye buttery for a year 00 a to pain ye brasier to hisfield yt slater taxe allowed to george 4r 6r mich 6r jennings 4r 6r mich 6r to james davies joiner for 3 horses going to longwitnam and charges for visising ye chancell to jo halifax iron monger for nails c abt ye house of office to townsend ye mason from apr 29 99 to may 31 1701 to mrs edwards towards ye rebuilding at ye south end of ye vicarage house of kedington by consent for buttery books at nat and bapts to fra bugge by consent for mr rennell s mine and my mans journey to slyfield abt yt and other estates given ye coll in reversion for 4 horses 6 dayes for yt journey for weeding and cleansing ye rd yard to mr clark bookseller for accting books paper c for 10 qrts of red galilia oct 5th 1701 to will day smith novembr 1st 1701 to james hilleard glacier to collison carpenter,1701,page
1701_5_image,to mr adams impensa coll et nota dom nativ 1700 to mr hutchins nil to do parn for longwitn fine dno rectri et socijs pro augm red southn et merton id stip et offrarijs pro augm red de cuddlingt 3 ptes stipend pro g d pte red augm de cuddlingt stipend et officiarijs pro red augm de longwitn soluta y guinear item pd for d battls for mr vivians batts ann 1700 2d ap bapt 1700 2s 11d for do huthnance batts mich 93 1 1 tdq nativ 1693 3s 2d to blake mich 1701 to pearse mich 1701 to jago mich 1701 to mr hutchins for ann 1700 d pearsons balt bapt 1700 item for mr harris bapt 1701 sub total summa omnium solutorum summa omnium receptorum et remanentium in cist summa omnium solutorum sir debet dns computans mem quod de 375 18s 9d anno superiori in cista remanentibus soluta fuit magro borman 149 1g 0d q sir jam in cista remanent tempore hujus computi 225 16s 11d quas d computans petit allorari petit allorari sir introduxit hoc anno sir remanent in cista hoc anno,1701,page
1702_1_image,imprimis reddidit comput de remanentib ni cista guinear anno long witenam mich minhinnet biennio southnewington mich merton biennio thrup mich chacckhill mich jue quit rents mich yardington mich ralph marshalls capons calcutt mich cudlington mills mich bampton biennio mountague quadriennio et dimidio hughes biennio greeneaway mich walker mich minne mich brome mich sadler mich sortinhully rush an hopkins an clifton ferry an bensington mich brew house south newington tenemr biennio jre thewin before ye lease jre thewin since ye lease p merton vicar anno gens com ners martin harris,1702,page
1702_2_image,guinear longwitnam minhinnett crismio southnewington ann cudlington rry pro an yardlington ann 5 mich st merton chalehill ann shrup cudlington vicar lucas eaton due quitrents ann ralph marshalls capons lord an 1 15 4 mich 1 14 4d calcots ann cudlington mills an 4 3 4 mich 3 19 6d bampton montague hughes greeneway p and walker an franklyn an minne harthall an leadenhall brome ann sadler ann 1 13 8d tintinhull rush ann hopkins ann clifton ferry bensington ann brewhouse south newington tenemt cudlington augm red ad testim purificasny trethwin merton vicarage ladlane sparks and meriton ann mendenham bapt and st thomas back gate jennings reed of ye revernd mr rich spry rr of west ogwell devon a legacy of ye revernd mr rich eastchurch rr of manato devon formerly sojourner of ye college summ,1702,page
1702_3_image,mr arthur champernonne reed of mr martyns caution towards 8 t due from him for his admission gent com mr mrs for act supper mr main 2 t mr shortridge 2 t mr acland 2 t mr neal 2 t mr shadwell 2 t commons library reed of mr verman 7 t 5 s of mr hutchins 12 s 6 d reed of mr verman for mr exam t bapt 1702 reed of mr adams on a mistake in his ach nahv 1700 reed of mr vice chancellor for his ground on wk the new buttresses to his divinity school stand sum sum tot recop cinitati oxon duobus annis coll edy chr majors capons coll edy chr collegio o animarum coll st joh bapt coll balioll curia hoystings procurat cudl southn merton janitorii coquo lotricu tonsori bibliothecario bibliothecario non graduat bedle of beggars scullion and quadrangle dno episcop in primario visitat west supervisor consecration sermon curate of southn corne prizes tenths of merton synodalls southn cudl merton prising bocardia 5 s 5 d castle 5 s 5 d,1702,page
1702_4_image,pauperis 69 biblior clerico aqua duct sum for the act dinner to coquus for fennel c fitts to william boyer for work and nails abt ye back yard to wt bookbinder for buttery books nat ann for 14 ells of auenbridge for a table cloth for ye fellows table to coquus for xmas newyears and twelve dayes dinners to lumley for lead and work over ye house office for mats in ye chapell to cosins for ye chapell ann 11 2 mich 6t 12t to broadwater for ye hall and buttery to mr recorder wright for advice abt my shiers will jennings ann 6r mich 8r george ann 6r mich 8r to james davey for work don in ye college to mr dodwell at mr wrights suite c to ye workmen att ye new buildings by consent to ye glazier to mr dubber for change and new making plate to mr brice a minister whose house was burnt by consent to wm day smith to mr white mercer for 2 doz of napkins to mr townsend for paving ye passage at ye west end of ye chapell cleasing ye yard behind ye lodgings given mr butler by consent for wine octob 5th to goodw george for a napkin for ye communion table to mr clark bookseller over reckond by mistake last year in franklings rent recd of ye reverd mr ritch spry r of west ogwell devon ye legacy of ye reverend mr rich eastchurch being so much given by him to ye college library for books bought for ye college library with ye legacy of ye rever d mr rich eastchurch for more added by ye college for buying ye said books to mr adams for mr harris batts natu 1700 to mr adams for dr pearsons batts mich 1700,1702,page
1702_5_image,item de impensis coll et nota domes sc to mr hutchins impensis ad fest bapt 1702 to sr pain for saddlers fine for garsington blake ann 15th mich 15r pears ann 15th mich 15 jugo ann 15th mich 15 item dno r th et socy s ad fest nativit augmento red southn et merton stipend et officiarys ad fest ann augm red de cudlingt 3q ptes stipend ad fest bapt 4ta pte augm red cudlingt stipend et officiarys ad fest michael red augm de longwitenh solut guineaar sum taken out of ye coll treasury may ye 27th and laid out on ye new buildings as ap pears by ye acct of ye new builds p 24 25th taken out of ye coll treasury aug 4th and laid out on ye said buildings p 28 29th lost by ye falling of luidors from 17s 6d to 17s they 14 in number lost by ye falling of other gold formerly also taken into ye treasury paid out upon ye vicarage house of cudlington sum summa omnium receptorium remanentium in cista summa omnium solutionum sic debet dns computans sed petit allocari pro remanent in cissa sic introduxit hoc anno sic remanent in cissa tempore computi,1702,page
1702_6_image,guindar pro anno long wittenham pro sexquianno minhinnel pro anno south newington pro mic merton pro anno chafe hill pro mic thorup pro sexquianno the quit rents pro mic calcut pro mic bampton pro triennio mountagu pro quinquennio dimidio hughs pro triennio mynne pro sexquianno leadon hall pro anno broom pro mic sadler pro mic rush pro mic hopkins pro mic clifton ferry pro anno bensington pro mic brewhouse pro anno south rewington tenem pro anno trethorvin pro anno merton vic pro biennio,1702,page
1703_1_image,imprimis reddidit comput de remanentib in cista jpro guinea longwitnam mich 1701 26 8d ann 1702 25 7os in pt minstead south newington merton chacehill mich thrup pro sesquianno jure quitrents mich colcott mich bampton triennio mountague quinquiennio et dimid hughes triennio minne sesquianno leaden hall ann molineux mich sadler mich rush mich hopkins clifton ferry an bensington mich brewhouse anno south newington 5t anno trethewin merton vicarage biennio,1703,page
1703_2_image,guinear longwitnam minhinnett southnewington ann cudlington r y anno vardington annui 5 s d merton chacehill ann 2 11 3 d thrup cudlington vicar lucas eaton sue quitrents ann 2 15 7 ralph marshalls capons lord ann 1 12 8 mich 1 18 3 calcott cudlington mills ann 3 d 16 2 d mile 4 d 10 d 10 d bampton montague ann 5 d hughes greeneway ann 10 d walker franklyn ann ex mich moyne hartshill anno molineux ann 1 13 4 d sadler an 16 2 d mich 2 2 7 d leaderhall timtinhull rush d ry napper ann 1 13 7 hopkins clifton ferry benington ann 1 9 8 brew house southnewington tenem pro anne cudlington augm red ad fest purificacony trenewin merton vicarage lad lane sparks and merton mederham bapt and st thomas day backgate george ann 2 d mich 2 d jennins ann 2 d mich 2 d sum,1703,page
1703_3_image,of mr hutchins at st tho day of mr verman bapt item for gent commoners of mr eldrick t of mr hall k of mr edm arscott te item of mr orchard for act supper item of mr verman for ye common s library recd of sr pett for plush used before by mr atland t of ye queens coming to oxford the money recd of sr pett t from ye queens comming to oxford item given away by me to ye poor of oxford summa omnium receptorum imprimis de solutis ordinariis civitati oxon coll edi xi majors capons coll edi xi coll oium animarum coll st jo bapt coll baliol curia hustings 1702 1s 8d procurators cudl southn merton janitori coquo lotrici ann 20r mich 20r tonsori bibliothecario bibliothecario non graduatorum bedle of beggars scullion and quadrangle pro episcopo in primaria visitat west supervisor consecration sermon curate of southnewington mich 1702 10th ann 10th corne prices tenths of merton synodally cudlingt southn merton prisn s bocardo 5s 5s castle 5s 5s pauperibus bibliorum clerico,1703,page
1703_4_image,for deficiency of money recd into and out of ye treasury acct dinner to geo pinnock for cleansing ye house of office mr ryots yard to wm west for a buttery book st thomas day 12th bapt to coques for xtmas and twelfth dayes dinners to coques for fewer 17th 20th more since ye cooks death q 15 6 paid to mr white mercer for plush for mr acland on y queens coming to oxford to mr lain brazer to wm day smith for candles for ye chapell to cosens for ye brittery to broadwater to mr hifield slater taxe jennins ann 8r mich 8r george ann 8r mich 8r to jenny taylor for making mr aclands gown to mr smith for making mr aclands horse cloth to boyer for greens in ye back yard to a scotch ministers widow by consent for cleansing ye college cellar to west to simon stubbs gardiner for work abt ye back yard to ye relict of dr loftus by consent to fra wright for cleansing ye yard behind ye lodgings to james davey joyner to jo baker wies drawer for wier for ye kitchin windowes expended this year in ye progress to mr dodwell for holding court at little suse to mr collison for flooring ye comon room to mr clark for paper wax c to mr sherwin for bringing ladlane and medenham rents for wine octob 5th 1 0 10 sum tintinhull fine blake ann 15r mich 15r pearse ann 15r mich 15r gage ann 15r mich 15r penrose ann 15r mich 15r pensions group total as bracketed laid out on ye new buildings as appears by ye new building acct p 38 39 laid out more ye sd buildings as appears p 45,1703,page
1703_5_image,ad fest nativ augm red southn et merton stipend et officiarijs ad fest ann augm red cuddingt 3s 3 pkes stipend et officiarijs ad fest bapt 4ta pte augm rd cuddingt stipend et officiarijs ad fest mich augm red longwrtn solut guinear sum omnium solutorum sum omnium receptorun 546 00 5 ob sum omnium solutorum 534 11 01 q sic debet dns computans 011 09 04 ob sed petit allocari pro remanentibus in cista sic introdusit hoc anno 008 09 08 ob sic remanent in cista tempore com pubis,1703,page
1703_6_image,guinsar pro anno long withenham pro lffguianno minhinst pro anno southinwington pro mic merton pro biennio cha hill pro mic thrup pro duobus annis dimidio tuc quit rents mic ralp martial s capons calcot pro lffguianno bampton pro quadriennio mountagu mic hubs pro quadriennio greenway pro mic walker pro anno min pro anno leaden hall pro biennio molinooux mic tinshinhull napper pro mic hopkins pro lffguianno clifton ferny pro anno benfsington mic brewhouse pro anno trethewen pro biennio murton vic pro biennio,1703,page
